{
  "schemaVersion": "v1",
  "correlation": { "correlationId": "corr-x03b-allocation" },
  "data": [{
    "allocation_id": "14000000-0000-4000-8000-000000000001",
    "allocation_no": "ALLOC-20260903-001",
    "warehouse_id": "40000000-0000-4000-8000-000000000001",
    "warehouse_location_id": "50000000-0000-4000-8000-000000000001",
    "item_type": "FINISHED_GOOD",
    "item_id": "20000000-0000-4000-8000-000000000001",
    "lot_code": "FG-LOT-20260903-001",
    "unit": "BOX",
    "source_object_type": "EXTERNAL_ORDER_ITEM",
    "source_object_id": "60000000-0000-4000-8000-000000000001",
    "source_object_no": "ORD-20260903-001/LINE-001",
    "allocated_quantity": "20.000",
    "status": "CONFIRMED",
    "requested_at": "2026-09-03T00:30:00Z",
    "confirmed_at": "2026-09-03T00:31:00Z"
  }],
  "meta": {
    "cursor_version": 1,
    "resource": "inventory.allocations",
    "snapshot_id": "11000000-0000-4000-8000-000000000004",
    "as_of": "2026-09-03T01:00:00Z",
    "high_watermark": "allocation-revision-0001",
    "next_cursor": null,
    "page_item_count": 1,
    "delivered_item_count": 1,
    "item_count": 1,
    "complete": true,
    "manifest_version": 1,
    "manifest_algorithm": "SHA-256",
    "manifest_canonicalization": "JCS_RFC8785",
    "manifest_sha256": "79570331b7d1c19baa39d233c5cda13270886b4f9999090df60a63b858217654",
    "delta_supported": false
  }
}
