{
  "schemaVersion": "v1",
  "correlation": { "correlationId": "corr-x03b-warehouse-location" },
  "data": [{
    "warehouse_location_id": "50000000-0000-4000-8000-000000000001",
    "warehouse_id": "40000000-0000-4000-8000-000000000001",
    "location_code": "FG-A-01",
    "location_name": "Finished Goods A-01",
    "location_type": "STORAGE_BIN",
    "status": "ACTIVE"
  }],
  "meta": {
    "cursor_version": 1,
    "snapshot_id": "11000000-0000-4000-8000-000000000006",
    "as_of": "2026-09-03T01:00:00Z",
    "high_watermark": "warehouse-location-revision-0001",
    "next_cursor": null,
    "item_count": 1,
    "complete": true,
    "manifest_sha256": "ffffffffffffffffffffffffffffffffffffffffffffffffffffffffffffffff",
    "delta_supported": false
  }
}
