{"schemaVersion":"v1","correlation":{"correlationId":"fixture-x03b-receipt"},"data":[{"warehouse_receipt_id":"17000000-0000-4000-8000-000000000002","warehouse_receipt_no":"WR-FIXTURE-002","status":"PENDING_CONFIRMATION","batch_id":"30000000-0000-4000-8000-000000000002","warehouse_id":"40000000-0000-4000-8000-000000000001","received_quantity":{"value":"10.000","unit":"BOX"},"created_at":"2026-09-03T00:38:00Z"}],"meta":{"cursor_version":1,"snapshot_id":"11000000-0000-4000-8000-000000000017","as_of":"2026-09-03T01:00:00Z","high_watermark":"fixture-receipt-1","next_cursor":null,"item_count":1,"complete":true,"manifest_sha256":"7777777777777777777777777777777777777777777777777777777777777777","delta_supported":false}}
