{
  "schemaVersion": "v1",
  "correlation": { "correlationId": "corr-x03b-warehouse-receipt" },
  "data": [{
    "warehouse_receipt_id": "17000000-0000-4000-8000-000000000001",
    "warehouse_receipt_no": "WR-20260903-001",
    "status": "CONFIRMED",
    "batch_id": "30000000-0000-4000-8000-000000000001",
    "warehouse_id": "40000000-0000-4000-8000-000000000001",
    "warehouse_location_id": "50000000-0000-4000-8000-000000000001",
    "received_quantity": { "value": "120.000", "unit": "hộp" },
    "received_at": "2026-09-03T00:39:00Z",
    "confirmed_at": "2026-09-03T00:40:00Z",
    "created_at": "2026-09-03T00:38:00Z"
  }],
  "meta": {
    "cursor_version": 1,
    "resource": "warehouse-receipts",
    "snapshot_id": "11000000-0000-4000-8000-000000000007",
    "as_of": "2026-09-03T01:00:00Z",
    "high_watermark": "warehouse-receipt-revision-0001",
    "next_cursor": null,
    "page_item_count": 1,
    "delivered_item_count": 1,
    "item_count": 1,
    "complete": true,
    "manifest_version": 1,
    "manifest_algorithm": "SHA-256",
    "manifest_canonicalization": "JCS_RFC8785",
    "manifest_sha256": "789d10e049ce56c3e6eecc7aca523f4c8e329de7e3aae8efc4dd4fdf15f1117b",
    "delta_supported": false
  }
}
