{
  "schemaVersion": "v1",
  "correlation": { "correlationId": "corr-x03b-stock-balance" },
  "data": [{
    "stock_balance_id": "10000000-0000-4000-8000-000000000001",
    "item_type": "FINISHED_GOOD",
    "sku_id": "20000000-0000-4000-8000-000000000001",
    "batch_id": "30000000-0000-4000-8000-000000000001",
    "lot_code": "FG-LOT-20260903-001",
    "warehouse_id": "40000000-0000-4000-8000-000000000001",
    "warehouse_location_id": "50000000-0000-4000-8000-000000000001",
    "on_hand_quantity": { "value": "120.000", "unit": "hộp" },
    "available_quantity": { "value": "100.000", "unit": "hộp" },
    "reserved_quantity": { "value": "20.000", "unit": "hộp" },
    "quality_hold_quantity": { "value": "0.000", "unit": "hộp" },
    "recall_hold_quantity": { "value": "0.000", "unit": "hộp" },
    "sale_lock_quantity": { "value": "0.000", "unit": "hộp" },
    "as_of": "2026-09-03T01:00:00Z"
  }],
  "meta": {
    "cursor_version": 1,
    "resource": "inventory.stock-balances",
    "snapshot_id": "11000000-0000-4000-8000-000000000001",
    "as_of": "2026-09-03T01:00:00Z",
    "high_watermark": "stock-balance-snapshot-0001",
    "next_cursor": null,
    "page_item_count": 1,
    "delivered_item_count": 1,
    "item_count": 1,
    "complete": true,
    "manifest_version": 1,
    "manifest_algorithm": "SHA-256",
    "manifest_canonicalization": "JCS_RFC8785",
    "manifest_sha256": "79dade2aaad018b42855b4f7d365675585fe6e5d7a5c09243fd9364d839a0cfe",
    "delta_supported": false
  }
}
